{
  "schemaVersion": "1.0",
  "mode": "fast",
  "business": {
    "name": "Canyon Wheelworks",
    "city": "Tucson, AZ",
    "category": "Bicycle repair shop",
    "summary": "A planning guide inspired by bicycle repair shop. Service and availability details are not confirmed."
  },
  "audience": {
    "primary": "Tucson bicycle commuters",
    "needs": [
      "Reliable help with everyday bicycle problems",
      "Convenient walk in service",
      "Clear information about available repairs",
      "Confirmed hours and location details"
    ]
  },
  "offerings": [
    {
      "name": "Commuter bicycle repair",
      "description": "Neighborhood repair service for bicycles used by local commuters.",
      "confidence": "confirmed"
    },
    {
      "name": "Walk in service",
      "description": "Riders are welcome to bring bicycles in without a scheduled appointment.",
      "confidence": "confirmed"
    },
    {
      "name": "Flat tire repair",
      "description": "Likely support for common tire and tube problems.",
      "confidence": "inferred"
    },
    {
      "name": "Brake and gear adjustment",
      "description": "Likely adjustment service for common braking and shifting issues.",
      "confidence": "inferred"
    },
    {
      "name": "Routine maintenance",
      "description": "Likely maintenance for bicycles used in regular travel.",
      "confidence": "inferred"
    }
  ],
  "brand": {
    "personality": [
      "Practical",
      "Neighborly",
      "Capable",
      "Direct"
    ],
    "voice": "Plainspoken and useful, with an emphasis on helping local riders understand their next step.",
    "aesthetic": "A workshop inspired layout with warm desert colors, strong typography, simple line drawings, and visible mechanical details. Services appear in one clear list rather than a grid of decorative cards.",
    "signatureMove": {
      "name": "The Service Wheel",
      "description": "A simple bicycle wheel illustration sits beside the service list. Moving across a service highlights one spoke while the full service text remains visible.",
      "touchFallback": "On touch devices, the wheel remains static and each service is paired with a clearly marked spoke.",
      "reducedMotion": "When reduced motion is enabled, the wheel does not rotate. Services use a simple color change for focus and selection."
    },
    "palette": {
      "background": "#F4EBDD",
      "surface": "#FFF9EF",
      "text": "#252A27",
      "accent": "#B5522B"
    }
  },
  "content": {
    "eyebrow": "Local inspiration",
    "headline": "Explore Ideas",
    "subheadline": "A practical starting point for considering bicycle repair shop before confirming details with the business.",
    "about": "Use these notes to clarify priorities, setting, and personal preferences before confirming details.",
    "primaryAction": "Explore Ideas",
    "secondaryAction": "Read Guidance",
    "contactPrompt": "Confirm Details"
  },
  "contact": {
    "phone": null,
    "email": null,
    "address": null,
    "hours": null
  },
  "facts": {
    "confirmed": [
      {
        "label": "Business name",
        "value": "Canyon Wheelworks",
        "source": "user"
      },
      {
        "label": "City",
        "value": "Tucson, AZ",
        "source": "user"
      },
      {
        "label": "Owner details",
        "value": "Neighborhood bicycle repair for commuters. Walk in service is welcome.",
        "source": "user"
      }
    ],
    "inferred": [
      {
        "label": "Business category",
        "value": "Bicycle repair shop",
        "confidence": "high"
      },
      {
        "label": "Primary audience",
        "value": "Tucson bicycle commuters",
        "confidence": "high"
      },
      {
        "label": "Likely services",
        "value": "Flat tire repair, brake and gear adjustment, and routine maintenance",
        "confidence": "medium"
      },
      {
        "label": "Brand direction",
        "value": "Practical neighborhood workshop with a warm desert inspired visual style",
        "confidence": "medium"
      }
    ],
    "needed": [
      "Phone number",
      "Email address",
      "Street address",
      "Opening hours",
      "Confirmed repair services",
      "Typical turnaround information",
      "Pricing or estimate policy",
      "Bicycle types accepted"
    ]
  }
}
