{
  "schemaVersion": "1.0",
  "mode": "fast",
  "business": {
    "name": "Harborlight Flower Studio",
    "city": null,
    "category": "Floral design studio",
    "summary": "A planning guide inspired by floral design studio. Service and availability details are not confirmed."
  },
  "audience": {
    "primary": "People seeking distinctive flowers for gifts, personal moments, and events",
    "needs": [
      "A simple way to request flowers",
      "Clear examples of the studio style",
      "Guidance on custom arrangements and event florals",
      "Reliable contact and ordering details"
    ]
  },
  "offerings": [
    {
      "name": "Custom arrangements",
      "description": "Seasonal floral designs created for gifts, celebrations, and personal spaces.",
      "confidence": "inferred"
    },
    {
      "name": "Event florals",
      "description": "Flowers for intimate gatherings, ceremonies, dinners, and other special occasions.",
      "confidence": "inferred"
    },
    {
      "name": "Everyday bouquets",
      "description": "Fresh bouquets designed for simple gestures and everyday beauty.",
      "confidence": "inferred"
    }
  ],
  "brand": {
    "personality": [
      "Warm",
      "Artful",
      "Calm",
      "Thoughtful"
    ],
    "voice": "Gentle, clear, and personal, with vivid but restrained language.",
    "aesthetic": "A quiet coastal still life style with natural textures, generous space, deep ink type, and close floral photography.",
    "signatureMove": {
      "name": "Flowers follow the light",
      "description": "A single botanical stem shifts subtly toward the pointer as visitors move through the opening section. All text and actions remain fixed and fully readable.",
      "touchFallback": "The stem appears as a static composition while every section and action remains available.",
      "reducedMotion": "The stem remains still with no animated transitions."
    },
    "palette": {
      "background": "#F5F0E7",
      "surface": "#E7DDCF",
      "text": "#20302D",
      "accent": "#B85C4A"
    }
  },
  "content": {
    "eyebrow": "Local inspiration",
    "headline": "Explore Ideas",
    "subheadline": "A practical starting point for considering floral design studio before confirming details with the business.",
    "about": "Use these notes to clarify priorities, setting, and personal preferences before confirming details.",
    "primaryAction": "Explore Ideas",
    "secondaryAction": "Read Guidance",
    "contactPrompt": "Confirm Details"
  },
  "contact": {
    "phone": null,
    "email": null,
    "address": null,
    "hours": null
  },
  "facts": {
    "confirmed": [
      {
        "label": "Business name",
        "value": "Harborlight Flower Studio",
        "source": "user"
      }
    ],
    "inferred": [
      {
        "label": "Business category",
        "value": "Floral design studio",
        "confidence": "high"
      },
      {
        "label": "Offering mix",
        "value": "Custom arrangements, everyday bouquets, and event florals",
        "confidence": "medium"
      },
      {
        "label": "Brand direction",
        "value": "Warm, artful, calm, and influenced by coastal light",
        "confidence": "medium"
      },
      {
        "label": "Primary audience",
        "value": "People seeking distinctive flowers for gifts and events",
        "confidence": "medium"
      }
    ],
    "needed": [
      "City and service area",
      "Phone number",
      "Email address",
      "Street address if customers may visit",
      "Opening hours",
      "Confirmed products and services",
      "Ordering process",
      "Delivery and pickup details",
      "Event inquiry requirements",
      "Owner story and studio background"
    ]
  }
}
