{
  "schemaVersion": "1.0",
  "mode": "fast",
  "business": {
    "name": "Juniper Oven",
    "city": null,
    "category": "Neighborhood bakery and cafe",
    "summary": "A planning guide inspired by neighborhood bakery and cafe. Service and availability details are not confirmed."
  },
  "audience": {
    "primary": "Local residents seeking fresh baked goods and a welcoming everyday stop",
    "needs": [
      "A clear view of what is available",
      "Easy access to location and hours",
      "Simple ways to ask about orders"
    ]
  },
  "offerings": [
    {
      "name": "Fresh bread",
      "description": "A focused selection of loaves and everyday breads.",
      "confidence": "inferred"
    },
    {
      "name": "Pastries",
      "description": "Sweet and savory pastries for morning visits and afternoon treats.",
      "confidence": "inferred"
    },
    {
      "name": "Seasonal bakes",
      "description": "A changing selection inspired by the season.",
      "confidence": "inferred"
    }
  ],
  "brand": {
    "personality": [
      "Warm",
      "Grounded",
      "Craft focused",
      "Inviting"
    ],
    "voice": "Plainspoken, sensory, and welcoming without making unsupported claims.",
    "aesthetic": "An editorial bakery style with warm paper tones, deep evergreen type, restrained botanical details, and close views of baked goods.",
    "signatureMove": {
      "name": "The Oven Window",
      "description": "A small oven window illustration gently opens as visitors explore the page and reveals the featured bake while the same information remains visible in text.",
      "touchFallback": "A clearly labeled button opens the featured bake panel without hiding any content.",
      "reducedMotion": "The oven window appears open as a static illustration with the featured bake already visible."
    },
    "palette": {
      "background": "#F3EBDD",
      "surface": "#FFF9EF",
      "text": "#24352D",
      "accent": "#A45432"
    }
  },
  "content": {
    "eyebrow": "Local inspiration",
    "headline": "Explore Ideas",
    "subheadline": "A practical starting point for considering neighborhood bakery and cafe before confirming details with the business.",
    "about": "Use these notes to clarify priorities, setting, and personal preferences before confirming details.",
    "primaryAction": "Explore Ideas",
    "secondaryAction": "Read Guidance",
    "contactPrompt": "Confirm Details"
  },
  "contact": {
    "phone": null,
    "email": null,
    "address": null,
    "hours": null
  },
  "facts": {
    "confirmed": [
      {
        "label": "Business name",
        "value": "Juniper Oven",
        "source": "user"
      }
    ],
    "inferred": [
      {
        "label": "Business category",
        "value": "Neighborhood bakery and cafe",
        "confidence": "medium"
      },
      {
        "label": "Primary audience",
        "value": "Local residents seeking fresh baked goods",
        "confidence": "medium"
      },
      {
        "label": "Offering mix",
        "value": "Fresh bread, pastries, and seasonal bakes",
        "confidence": "low"
      },
      {
        "label": "Brand direction",
        "value": "Warm, grounded, and craft focused",
        "confidence": "medium"
      }
    ],
    "needed": [
      "City",
      "Confirmed business category",
      "Confirmed products and services",
      "Phone number",
      "Email address",
      "Street address",
      "Opening hours",
      "Ordering details"
    ]
  }
}
